{
  "schema_version": 4,
  "run_id": 1784453891,
  "created": "2026-07-19T15:38:11",
  "dataset": "gislr",
  "architecture": "gru",
  "model_name": "StreamingGRU",
  "streaming": true,
  "subset": "ME_126",
  "coords": "xy",
  "n_landmarks": 126,
  "feature_dim": 252,
  "n_classes": 250,
  "n_params": 851698,
  "split": {
    "strategy": "stratified 90/10",
    "random_state": 42,
    "n_val": 9448
  },
  "training": {
    "regime": "v2-plateau-300",
    "source": "gislr.1.models.training.ipynb",
    "epoch_cap": 300,
    "epochs_trained": 81,
    "best_epoch": 75,
    "early_stopped": true,
    "finished": true,
    "wall_time_min": 11.4
  },
  "hyperparameters": {
    "batch_size": 1024,
    "lr": 0.001414,
    "hidden_size": 256,
    "num_layers": 2,
    "dropout": 0.3,
    "weight_decay": 0.0001,
    "epochs": 300,
    "grad_clip": 5.0,
    "lr_factor": 0.5,
    "lr_patience": 5,
    "es_patience": 15,
    "es_min_delta": 0.001,
    "seed": 42,
    "max_seq_len": 128,
    "num_workers": 0,
    "loss": "CE + label smoothing 0.1",
    "precision": "AMP"
  },
  "metrics": {
    "train_val_acc": 0.7566,
    "eval_status": "canonical",
    "overall_accuracy": 0.7564563928873835,
    "macro_accuracy": 0.7546843838694886,
    "median_class_accuracy": 0.7567567567567568,
    "n_classes_below_50pct": 8
  },
  "checkpoints": {
    "best": "best.pt",
    "last": "last.pt"
  },
  "assets": {
    "landmarks": "assets/landmarks.npy",
    "history": "assets/history.json",
    "per_class_csv": "assets/per_class_accuracy.csv",
    "per_class_png": "assets/per_class_accuracy.png",
    "eval_summary": "assets/eval_summary.json",
    "val_predictions": "assets/val_predictions.npz",
    "submission_zip": "export/submission.zip",
    "tflite": "export/model.tflite"
  },
  "submission": {
    "tested": false,
    "platform": null,
    "submitted_at": null,
    "public_score": null,
    "private_score": null,
    "reference": null,
    "notes": ""
  },
  "notes": "ME_126 \u00b7 gru \u00b7 regime v2-plateau-300.",
  "provenance": null
}