{
  "schema_version": 4,
  "run_id": 1790416770,
  "created": "2026-09-26T15:59:30",
  "dataset": "gislr",
  "architecture": "cnn1d_phono130",
  "model_name": "CausalConv1D",
  "streaming": true,
  "subset": "FULL_543",
  "coords": "xyz",
  "n_landmarks": 543,
  "feature_dim": 130,
  "n_classes": 250,
  "n_params": 1545982,
  "split": {
    "strategy": "stratified 80/20 (fixed, GISLR_Stratified-provided)",
    "random_state": 42,
    "n_val": 18896
  },
  "training": {
    "regime": "v2-plateau-300",
    "source": "gislr.1.models.training.ipynb",
    "epoch_cap": 300,
    "epochs_trained": 102,
    "best_epoch": 101,
    "early_stopped": true,
    "finished": true,
    "wall_time_min": 16.3
  },
  "hyperparameters": {
    "batch_size": 1024,
    "lr": 0.001414,
    "hidden_size": 256,
    "num_layers": 5,
    "dropout": 0.3,
    "weight_decay": 0.0001,
    "epochs": 300,
    "grad_clip": 5.0,
    "lr_factor": 0.5,
    "lr_patience": 5,
    "es_patience": 15,
    "es_min_delta": 0.001,
    "frontend": "phono",
    "mirror_p": 0.0,
    "landmark_subset": "FULL_543",
    "seed": 42,
    "max_seq_len": 128,
    "num_workers": 0,
    "loss": "CE + label smoothing 0.1",
    "precision": "AMP"
  },
  "provenance": {
    "git_commit": "518e8a629a762350e08f554f78a7497ee0b5e78c",
    "git_branch": "main",
    "git_dirty": true,
    "code_dirty": false,
    "dirty_code_paths": [],
    "config_path": "experiments/recognition/configs/gislr.training.json",
    "config_sha256": "sha256:8454aa600eede76dd5decc2fc5fe959da24bd92b7e96e11801273c1143afa397",
    "feature_pipeline": "phono130_v1",
    "feature_cache_key": "157b4b1550f45acf",
    "source": {
      "name": "gislr",
      "kaggle_ref": "bracu23101281/gislr-stratified",
      "version": null,
      "n_videos": 94477,
      "manifest": "train.csv",
      "manifest_sha256": "sha256:1a1d3a1fa62e83e57ed4df30925c3aeee631910f960841f8bb877e3bbf7801b4",
      "resolved_dir": "C:\\Users\\user2\\.cache\\kagglehub\\datasets\\bracu23101281\\gislr-stratified\\versions\\1"
    },
    "env": {
      "python": "3.12.3",
      "platform": "win32-AMD64",
      "gpu": "NVIDIA GeForce RTX 4080 SUPER",
      "cuda": "13.0",
      "torch": "2.13.0+cu130",
      "numpy": "2.5.1",
      "pandas": "3.0.3",
      "pyarrow": "24.0.0",
      "scikit-learn": "1.9.0",
      "mediapipe": "0.10.35"
    },
    "captured_at": "2026-09-26T15:59:28"
  },
  "metrics": {
    "train_val_acc": 0.7329,
    "eval_status": "canonical",
    "overall_accuracy": 0.7329593564775614,
    "macro_accuracy": 0.7307909841943342,
    "median_class_accuracy": 0.7449292001530807,
    "n_classes_below_50pct": 12
  },
  "checkpoints": {
    "best": "best.pt",
    "last": "last.pt"
  },
  "assets": {
    "landmarks": "assets/landmarks.npy",
    "history": "assets/history.json",
    "per_class_csv": "assets/per_class_accuracy.csv",
    "per_class_png": "assets/per_class_accuracy.png",
    "eval_summary": "assets/eval_summary.json",
    "val_predictions": "assets/val_predictions.npz"
  },
  "submission": {
    "tested": true,
    "platform": "local",
    "submitted_at": "2026-09-26T16:18:28",
    "public_score": 0.7329593564775614,
    "private_score": null,
    "reference": "gislr canonical eval",
    "notes": "scored on gislr's held-out test split (18896 videos) via sb.recognize.evaluate \u2014 no external leaderboard"
  },
  "notes": "TODO \u00a73.10 \u2014 causal CNN on the 130 phonological features only; 5 dilated blocks = 125-frame receptive field, as cnn1d. Standard es_patience 15: the first run (1790413038, patience 10) stopped before its LR ever decayed."
}