{
  "schema_version": 4,
  "run_id": 1790411081,
  "created": "2026-09-26T14:24:41",
  "dataset": "gislr",
  "architecture": "gru_phono",
  "model_name": "PhonoGRU",
  "streaming": true,
  "subset": "PH_55",
  "coords": "xyz",
  "n_landmarks": 55,
  "feature_dim": 165,
  "n_classes": 250,
  "n_params": 722338,
  "split": {
    "strategy": "stratified 80/20 (fixed, GISLR_Stratified-provided)",
    "random_state": 42,
    "n_val": 18896
  },
  "training": {
    "regime": "v2-plateau-300",
    "source": "gislr.1.models.training.ipynb",
    "epoch_cap": 300,
    "epochs_trained": 59,
    "best_epoch": 55,
    "early_stopped": false,
    "finished": false,
    "wall_time_min": 8.0
  },
  "hyperparameters": {
    "batch_size": 1024,
    "lr": 0.001414,
    "hidden_size": 256,
    "num_layers": 2,
    "dropout": 0.3,
    "weight_decay": 0.0001,
    "epochs": 300,
    "grad_clip": 5.0,
    "lr_factor": 0.5,
    "lr_patience": 5,
    "es_patience": 15,
    "es_min_delta": 0.001,
    "frontend": "phono",
    "mirror_p": 0.0,
    "landmark_subset": "PH_55",
    "seed": 42,
    "max_seq_len": 128,
    "num_workers": 0,
    "loss": "CE + label smoothing 0.1",
    "precision": "AMP"
  },
  "provenance": {
    "git_commit": "98adca009a1c19054d4dac12328e5532cbf7baeb",
    "git_branch": "main",
    "git_dirty": true,
    "code_dirty": false,
    "dirty_code_paths": [],
    "config_path": "experiments/recognition/configs/gislr.training.json",
    "config_sha256": "sha256:9bc71fc550ac9a357704dcb8eca1bc7da484c13aadc15ea1e3228f6386871f43",
    "feature_pipeline": "base_v1",
    "feature_cache_key": "f36545d67ec0ded2",
    "source": {
      "name": "gislr",
      "kaggle_ref": "bracu23101281/gislr-stratified",
      "version": null,
      "n_videos": 94477,
      "manifest": "train.csv",
      "manifest_sha256": "sha256:1a1d3a1fa62e83e57ed4df30925c3aeee631910f960841f8bb877e3bbf7801b4",
      "resolved_dir": "C:\\Users\\user2\\.cache\\kagglehub\\datasets\\bracu23101281\\gislr-stratified\\versions\\1"
    },
    "env": {
      "python": "3.12.3",
      "platform": "win32-AMD64",
      "gpu": "NVIDIA GeForce RTX 4080 SUPER",
      "cuda": "13.0",
      "torch": "2.13.0+cu130",
      "numpy": "2.5.1",
      "pandas": "3.0.3",
      "pyarrow": "24.0.0",
      "scikit-learn": "1.9.0",
      "mediapipe": "0.10.35"
    },
    "captured_at": "2026-09-26T14:24:38"
  },
  "metrics": {
    "train_val_acc": 0.7008,
    "eval_status": "pending",
    "overall_accuracy": null,
    "macro_accuracy": null,
    "median_class_accuracy": null,
    "n_classes_below_50pct": null
  },
  "checkpoints": {
    "best": "best.pt",
    "last": "last.pt"
  },
  "assets": {
    "landmarks": "assets/landmarks.npy",
    "history": "assets/history.json"
  },
  "submission": {
    "tested": false,
    "platform": null,
    "submitted_at": null,
    "public_score": null,
    "private_score": null,
    "reference": null,
    "notes": ""
  },
  "notes": "TODO \u00a73.9 arm 1 \u2014 phonology features only (84/frame: per hand handshape 25, orientation 6, location 9, present 1; + 2 elbow angles), shoulder-normalized per frame. Same StreamingGRU and regime as gru; frontend/mirror_p are ignored by classes without a front-end."
}