{
  "schema_version": 4,
  "run_id": 1789258464,
  "created": "2026-09-13T06:14:24",
  "dataset": "gislr",
  "architecture": "bilstm",
  "model_name": "BiLSTM",
  "streaming": false,
  "subset": "ME_126",
  "coords": "xy",
  "n_landmarks": 126,
  "feature_dim": 252,
  "n_classes": 250,
  "n_params": 2751218,
  "split": {
    "strategy": "stratified 90/10",
    "random_state": 42,
    "n_val": 9448
  },
  "training": {
    "regime": "v2-plateau-300",
    "source": "gislr.1.models.training.ipynb",
    "epoch_cap": 300,
    "epochs_trained": 54,
    "best_epoch": 52,
    "early_stopped": true,
    "finished": true,
    "wall_time_min": 12.0
  },
  "hyperparameters": {
    "batch_size": 1024,
    "lr": 0.001414,
    "hidden_size": 256,
    "num_layers": 2,
    "dropout": 0.3,
    "weight_decay": 0.0001,
    "epochs": 300,
    "grad_clip": 5.0,
    "lr_factor": 0.5,
    "lr_patience": 5,
    "es_patience": 15,
    "es_min_delta": 0.001,
    "seed": 42,
    "max_seq_len": 128,
    "num_workers": 0,
    "loss": "CE + label smoothing 0.1",
    "precision": "AMP"
  },
  "provenance": {
    "git_commit": "a626da4290daf9572a81574cae89853100eacbe8",
    "git_branch": "main",
    "git_dirty": true,
    "code_dirty": true,
    "dirty_code_paths": [
      "experiments/recognition/configs/gislr.training.json",
      "packages/sb-mlops/src/sb/mlops/registry.py",
      "packages/sb-recognize/src/sb/recognize/architectures.py"
    ],
    "config_path": "experiments/recognition/configs/gislr.training.json",
    "config_sha256": "sha256:7c3886da1f92b8c31c3c315a1b873f0edb49924255c65e7b113684452746e0b0",
    "feature_pipeline": "base_v1",
    "feature_cache_key": "a4b7673e6f1b36fe",
    "source": {
      "name": "gislr",
      "kaggle_ref": "asl-signs",
      "version": null,
      "n_videos": 94477,
      "manifest": "train.csv",
      "manifest_sha256": "sha256:06cbf68cbdfe4b02413c3d3d6a3e02d5d65e42fd1e83102ef6d65a42f3dfb2a4",
      "resolved_dir": "C:\\Users\\user2\\.cache\\kagglehub\\competitions\\asl-signs"
    },
    "env": {
      "python": "3.12.3",
      "platform": "win32-AMD64",
      "gpu": "NVIDIA GeForce RTX 4080 SUPER",
      "cuda": "13.0",
      "torch": "2.13.0+cu130",
      "numpy": "2.5.1",
      "pandas": "3.0.3",
      "pyarrow": "24.0.0",
      "scikit-learn": "1.9.0",
      "mediapipe": "0.10.35"
    },
    "captured_at": "2026-09-13T06:14:23"
  },
  "metrics": {
    "train_val_acc": 0.7503,
    "eval_status": "canonical",
    "overall_accuracy": 0.8719305673158341,
    "macro_accuracy": 0.8708349027554381,
    "median_class_accuracy": 0.8791891891891892,
    "n_classes_below_50pct": 0
  },
  "checkpoints": {
    "best": "best.pt",
    "last": "last.pt"
  },
  "assets": {
    "landmarks": "assets/landmarks.npy",
    "history": "assets/history.json",
    "per_class_csv": "assets/per_class_accuracy.csv",
    "per_class_png": "assets/per_class_accuracy.png",
    "eval_summary": "assets/eval_summary.json",
    "val_predictions": "assets/val_predictions.npz",
    "submission_zip": "export/submission.zip",
    "tflite": "export/model.tflite"
  },
  "submission": {
    "tested": true,
    "platform": "local",
    "submitted_at": "2026-09-16T20:19:38",
    "public_score": 0.8719305673158341,
    "private_score": null,
    "reference": "gislr canonical eval",
    "notes": "scored on gislr's held-out test split (18896 videos) via sb.recognize.evaluate \u2014 no external leaderboard"
  },
  "notes": "ME_126 \u00b7 bilstm \u00b7 regime v2-plateau-300."
}