{
  "schema_version": 4,
  "run_id": 1790416771,
  "created": "2026-09-26T15:59:31",
  "dataset": "gislr",
  "architecture": "gru_continuous_phono130",
  "model_name": "ContinuousGRU",
  "streaming": true,
  "subset": "ME_132",
  "coords": "xy",
  "n_landmarks": 132,
  "feature_dim": 130,
  "n_classes": 250,
  "n_params": 824325,
  "split": {
    "strategy": "stratified 80/20 (fixed, GISLR_Stratified-provided)",
    "random_state": 42,
    "n_val": 18896
  },
  "training": {
    "regime": "continuous-v1",
    "source": "gislr.1.models.continuous.ipynb",
    "epoch_cap": 150,
    "epochs_trained": 49,
    "best_epoch": 38,
    "early_stopped": true,
    "finished": true,
    "wall_time_min": 17.6
  },
  "hyperparameters": {
    "loss": "per-frame CE over glosses+null (label smoothing, ramped sign weights) + boundary BCE",
    "batch_size": 64,
    "lr": 0.001,
    "hidden_size": 256,
    "num_layers": 2,
    "dropout": 0.3,
    "embed_dim": 256,
    "cos_scale": 16.0,
    "weight_decay": 0.0001,
    "epochs": 150,
    "grad_clip": 5.0,
    "lr_factor": 0.5,
    "lr_patience": 4,
    "es_patience": 12,
    "es_min_delta": 0.001,
    "label_smoothing": 0.1,
    "null_weight": 0.5,
    "ramp_start": 0.3,
    "boundary_weight": 0.5,
    "landmark_subset": "ME_132",
    "seed": 42,
    "max_seq_len": null,
    "num_workers": 0,
    "precision": "AMP",
    "composer": {
      "signs_per_seq": [
        1,
        6
      ],
      "gap_frames": [
        0,
        15
      ],
      "rest_frames": [
        5,
        30
      ],
      "p_lowered_rest": 0.7,
      "rest_ramp_frames": 8,
      "rest_default_drop": 0.3,
      "hand_visible_max": 0.9,
      "rest_jitter": 0.002,
      "max_frames": 600,
      "boundary_before": 2,
      "boundary_after": 1
    },
    "val_fraction": 0.05,
    "held_out_glosses": []
  },
  "provenance": {
    "git_commit": "518e8a629a762350e08f554f78a7497ee0b5e78c",
    "git_branch": "main",
    "git_dirty": true,
    "code_dirty": false,
    "dirty_code_paths": [],
    "config_path": "experiments/recognition/configs/gislr.continuous.json",
    "config_sha256": "sha256:223df7bfbf354c0359a543ea2644b3f143cc448c14b2423b322d6458dd661776",
    "feature_pipeline": "phono130_v1",
    "feature_cache_key": "157b4b1550f45acf",
    "source": {
      "name": "gislr",
      "kaggle_ref": "bracu23101281/gislr-stratified",
      "version": null,
      "n_videos": 75581,
      "manifest": "train.csv",
      "manifest_sha256": "sha256:1a1d3a1fa62e83e57ed4df30925c3aeee631910f960841f8bb877e3bbf7801b4",
      "resolved_dir": "C:\\Users\\user2\\.cache\\kagglehub\\datasets\\bracu23101281\\gislr-stratified\\versions\\1"
    },
    "env": {
      "python": "3.12.3",
      "platform": "win32-AMD64",
      "gpu": "NVIDIA GeForce RTX 4080 SUPER",
      "cuda": "13.0",
      "torch": "2.13.0+cu130",
      "numpy": "2.5.1",
      "pandas": "3.0.3",
      "pyarrow": "24.0.0",
      "scikit-learn": "1.9.0",
      "mediapipe": "0.10.35"
    },
    "captured_at": "2026-09-26T15:59:31"
  },
  "metrics": {
    "train_val_acc": 0.6971,
    "eval_status": "canonical",
    "overall_accuracy": 0.7259737510584251,
    "macro_accuracy": 0.7234729422523981,
    "median_class_accuracy": 0.7434164934164934,
    "n_classes_below_50pct": 12
  },
  "checkpoints": {
    "best": "best.pt",
    "last": "last.pt"
  },
  "assets": {
    "landmarks": "assets/landmarks.npy",
    "history": "assets/history.json",
    "per_class_csv": "assets/per_class_accuracy.csv",
    "per_class_png": "assets/per_class_accuracy.png",
    "eval_summary": "assets/eval_summary.json",
    "val_predictions": "assets/val_predictions.npz"
  },
  "submission": {
    "tested": true,
    "platform": "local",
    "submitted_at": "2026-09-26T16:19:50",
    "public_score": 0.7259737510584251,
    "private_score": null,
    "reference": "gislr canonical eval",
    "notes": "scored on gislr's held-out test split (18896 videos) via sb.recognize.evaluate \u2014 no external leaderboard"
  },
  "notes": "P1: C1's recipe on the 130 phonological features only (feature pipeline phono130_v1; streams composed in feature space by sb.recognize.continuous.phono; evaluated on GISLR-Sentences through the real extractor). TODO \u00a73.10 -> \u00a712.3. Continuous streams composed from train.csv (71801 clips; 3780 held out for selection, seed 42); held-out glosses: none. Selection metric = segment accuracy on validation streams, not the canonical isolated split."
}